{
  "capabilities": [
    {
      "id": "dummyjson.cart.add",
      "path": "cart.add.json",
      "version": "0.1.0"
    },
    {
      "id": "dummyjson.cart.list",
      "path": "cart.list.json",
      "version": "0.1.0"
    },
    {
      "id": "dummyjson.cart.remove",
      "path": "cart.remove.json",
      "version": "0.1.0"
    },
    {
      "id": "dummyjson.product.list",
      "path": "product.list.json",
      "version": "0.1.0"
    },
    {
      "id": "dummyjson.product.recommendations",
      "path": "product.recommendations.json",
      "version": "0.1.0"
    },
    {
      "id": "dummyjson.product.search",
      "path": "product.search.json",
      "version": "0.1.0"
    }
  ],
  "generated_at": "2026-05-03T06:56:57.811Z",
  "subdirectories": [],
  "version": "0.2.0"
}
